<?xml version="1.0" encoding="utf-8"?>
<xs:schema xmlns:xs="http://www.w3.org/2001/XMLSchema">
  <xs:element name="alumnos">
    <xs:complexType>
      <xs:sequence>
        <xs:element name="alumno" maxOccurs="unbounded">
          <xs:complexType>
            <xs:sequence>
              <xs:element name="nombre" type="xs:string"/>
              <xs:element name="control" type="xs:string"/>
              <xs:element name="edad" type="xs:int"/>
              <xs:element name="carrera" type="xs:string"/>
              <xs:element name="semestre" type="xs:int"/>
            </xs:sequence>
          </xs:complexType>
        </xs:element>
      </xs:sequence>
    </xs:complexType>
  </xs:element>
</xs:schema>